{"schemaVersion":"1.0.0","runId":"fixture-automation-2-001","startedAt":"2026-08-22T00:10:00.000Z","finishedAt":"2026-08-22T00:11:12.000Z","status":"warning","summary":{"passed":2,"warning":1,"failed":0,"skipped":0},"results":[{"id":"content-draft-generation","kind":"content-generation","status":"passed","startedAt":"2026-08-22T00:10:00.000Z","durationMs":2400,"evidence":{"generated":2,"fixture":true}},{"id":"content-owner-review","kind":"content-approval","status":"warning","startedAt":"2026-08-22T00:10:08.000Z","durationMs":12,"evidence":{"pending":1,"fixture":true}}],"approvals":[{"id":"automation-2-post-approval","action":"Approve generated Raven Sharp post","reason":"Fixture content result is ready for owner review.","risk":"low","status":"pending"}]}
